{
  "schemaVersion": "jurisdiction-registry.v1",
  "dataMode": "synthetic",
  "generatedAt": "2026-08-06T12:00:00.000Z",
  "asOf": "2026-08-06T12:00:00.000Z",
  "jurisdictions": [
    {
      "jurisdictionId": "jurisdiction:ca",
      "countryCode": "CA",
      "versions": [
        {
          "versionId": "jv:ca",
          "name": "Canada synthetic fixture",
          "slug": "canada-synthetic",
          "kind": "country",
          "status": "active",
          "effectiveFrom": "2020-01-01T00:00:00.000Z",
          "effectiveTo": null,
          "attribution": {
            "assertionId": "assertion:jv:ca",
            "sourceReference": "synthetic://registry/assertion:jv:ca",
            "observedAt": "2026-08-06T12:00:00.000Z",
            "freshness": "current",
            "coverage": "supported",
            "conflict": "clear",
            "supersedesAssertionId": null
          }
        }
      ]
    },
    {
      "jurisdictionId": "jurisdiction:us",
      "countryCode": "US",
      "versions": [
        {
          "versionId": "jv:us",
          "name": "United States synthetic fixture",
          "slug": "united-states-synthetic",
          "kind": "country",
          "status": "active",
          "effectiveFrom": "2020-01-01T00:00:00.000Z",
          "effectiveTo": null,
          "attribution": {
            "assertionId": "assertion:jv:us",
            "sourceReference": "synthetic://registry/assertion:jv:us",
            "observedAt": "2026-08-06T12:00:00.000Z",
            "freshness": "current",
            "coverage": "supported",
            "conflict": "clear",
            "supersedesAssertionId": null
          }
        }
      ]
    }
  ],
  "jurisdictionRelationships": [],
  "districts": [],
  "districtJurisdictionRelationships": [],
  "districtLineage": [],
  "publicBodies": [],
  "bodyJurisdictionRelationships": [],
  "offices": [],
  "externalIdentifiers": [],
  "gaps": [],
  "deferredFamilies": [
    "people",
    "office_terms",
    "candidacies",
    "source_ingestion",
    "location_resolution"
  ],
  "page": { "nextCursor": null }
}
